Name,2023,2022,2021,2020,All
21Shares Bitcoin ETP,54.19%,-63.74%,80.17%,249.79%,252.35%
Lyxor MSCI Semiconductors UCITS ETF - Acc,55.11%,-33.09%,34.69%,24.79%,74.44%
iShares S&P 500 Energy Sector UCITS ETF (Acc),-8.87%,74.94%,67.04%,-40.00%,59.78%
Invesco CoinShares Global Blockchain UCITS ETF Acc,14.98%,-48.37%,35.55%,76.28%,41.85%
Xtrackers LPX MM Private Equity Swap UCITS ETF 1C,15.59%,-30.03%,63.26%,0.15%,32.24%
WisdomTree Cloud Computing UCITS ETF USD Acc,28.54%,-48.77%,4.79%,91.41%,32.08%
Lyxor MSCI Turkey UCITS ETF - Acc,-17.20%,104.42%,-22.03%,-16.97%,9.58%

