Name,2023,2022,2021,2020,All
21Shares Binance BNB ETP,6.55%,-51.78%,1381.39%,140.63%,1731.47%
WisdomTree Bitcoin,3.47%,-63.52%,77.85%,263.52%,144.03%
SPDR S&P US Energy Select Sector UCITS ETF,-1.27%,73.99%,65.22%,-38.54%,74.43%
VanEck Video Gaming and eSports UCITS ETF,2.95%,-30.03%,6.32%,68.16%,28.79%
Invesco CoinShares Global Blockchain UCITS ETF Acc,2.21%,-48.37%,35.55%,76.28%,26.10%
Lyxor MSCI Turkey UCITS ETF - Acc,-6.94%,104.42%,-22.03%,-16.97%,23.15%
iShares Dow Jones China Offshore 50 UCITS ETF (DE),10.90%,-14.05%,-22.84%,15.85%,-14.79%

