Name,2023,2022,2021,2020,All
iShares S&P 500 Energy Sector UCITS ETF (Acc),-10.90%,74.94%,67.04%,-40.00%,56.22%
VanEck Video Gaming and eSports UCITS ETF,22.31%,-30.03%,6.32%,68.16%,53.01%
Invesco CoinShares Global Blockchain UCITS ETF Acc,12.62%,-48.37%,35.55%,76.28%,38.94%
Xtrackers LPX MM Private Equity Swap UCITS ETF 1C,9.06%,-30.03%,63.26%,0.15%,24.77%
Lyxor MSCI Turkey UCITS ETF - Acc,-19.34%,104.42%,-22.03%,-16.97%,6.74%
21Shares Bitcoin Cash ETP,121.16%,-77.10%,31.16%,47.05%,-2.32%
WisdomTree WTI Crude Oil,-13.26%,37.40%,78.75%,-55.99%,-6.24%

