Name,2022,2021,2020,2019,All
21Shares Crypto Basket Index ETP,-71.97%,166.39%,241.24%,20.41%,271.23%
L&G Battery Value-Chain UCITS ETF,-7.84%,25.62%,64.35%,20.03%,128.38%
iShares S&P 500 Energy Sector UCITS ETF (Acc),75.61%,67.04%,-40.00%,13.35%,99.50%
Xtrackers LPX MM Private Equity Swap UCITS ETF 1C,-29.66%,63.26%,0.15%,45.04%,66.81%
Lyxor NYSE Arca Gold BUGS (DR) UCITS ETF,1.31%,-8.06%,15.44%,53.07%,64.59%
Lyxor MSCI Turkey UCITS ETF - Acc,101.22%,-22.03%,-16.97%,12.26%,46.24%
Invesco Physical Palladium,-6.40%,-14.01%,13.43%,54.34%,40.91%
HANetf EMQQ Emerging Markets Internet & Ecommerce UCITS ETF,-25.79%,-27.36%,65.81%,34.59%,20.30%

